{
  "$schema": "http://json-schema.org/draft-07/schema#",
  "$id": "https://kari-writer.local/contracts/schemas/comments/meta_data.schema.json",
  "title": "CommentThreadMeta",
  "type": "object",
  "additionalProperties": true,
  "required": [
    "threadId",
    "commentType",
    "status",
    "version",
    "createdAt",
    "anchor"
  ],
  "properties": {
    "threadId": { "type": "string", "minLength": 1 },
    "targetId": { "type": "string", "minLength": 1 },
    "filePath": { "type": "string", "minLength": 1 },
    "originBranch": { "type": "string" },
    "commentType": {
      "type": "string",
      "enum": ["document", "prototype"]
    },
    "status": {
      "type": "string",
      "enum": ["open", "resolved"]
    },
    "version": {
      "type": "integer",
      "minimum": 1,
      "description": "Concurrency token — bump on each thread mutation"
    },
    "createdAt": { "type": "string" },
    "updatedAt": { "type": "string" },
    "createdBy": { "type": "integer" },
    "resolvedAt": { "type": ["string", "null"] },
    "resolvedBy": { "type": ["integer", "null"] },
    "resolvedInCommitSha": { "type": ["string", "null"] },
    "anchor": { "$ref": "#/$defs/anchor" }
  },
  "$defs": {
    "anchor": {
      "type": "object",
      "additionalProperties": true,
      "required": ["filePath"],
      "properties": {
        "branchName": { "type": "string" },
        "filePath": { "type": "string", "minLength": 1 },
        "anchorState": {
          "type": "string",
          "enum": ["active", "stale", "orphaned"]
        },
        "startLine": { "type": "integer", "minimum": 1 },
        "endLine": { "type": "integer", "minimum": 1 },
        "baseCommitSha": { "type": "string" }
      }
    }
  }
}
